{
  "activationCode": "SSP-7K4M-Q2XD-9HTR",
  "installId": "01K5T0Q8C4000000000000H001",
  "installCode": "8S91-254H",
  "deviceName": "KIRKGATE-TILL1",
  "appVersion": "3.0.412",
  "os": {
    "name": "Windows 11 Pro",
    "version": "10.0.26200",
    "architecture": "x64"
  },
  "tillClockUtc": "2026-09-26T09:00:03Z",
  "approverKids": [
    "k76b44696"
  ],
  "trustedKids": [
    "k13799fa4",
    "k76b44696"
  ],
  "registerName": "Till 1",
  "existingIds": null,
  "localLicenceToken": null
}
